<settings xmlns:xsi="http://www.w3.org/2001/XMLSchema-instance"
 xsi:noNamespaceSchemaLocation="settings.xsd">
    <profiles>
        <profile>
            <id>readMaven</id>
            <activation>
                <property>
                    <name>de.github.yfons.rapidfx</name>
                </property>
            </activation>
            <properties>
                <myMavenRepoReadUrl>https://mymavenrepo.com/repo/Fn0i73Weo588xIb0YPQp/</myMavenRepoReadUrl>
            </properties>
        </profile>
    </profiles>
</settings>
